{
  "medium": "english",
  "subject": "science",
  "chapter": "chapter-slug",
  "status": "draft",
  "items": [
    {
      "id": "subject-chapter-docx-view",
      "title": "Chapter DOCX View",
      "type": "docx",
      "mode": "google-drive-view",
      "viewUrl": "PASTE_GOOGLE_DRIVE_VIEW_LINK_HERE",
      "downloadAllowed": false,
      "status": "draft"
    },
    {
      "id": "subject-chapter-pdf-view",
      "title": "Chapter PDF View",
      "type": "pdf",
      "mode": "google-drive-view",
      "viewUrl": "PASTE_GOOGLE_DRIVE_VIEW_LINK_HERE",
      "downloadAllowed": false,
      "status": "draft"
    }
  ]
}
